{
  "decimalSeperator" : "comma",
  "sourceFile" : "telnet://192.0.2.16:80/",
  "payload" : [ {
    "variableNames" : [ "eOMtThyhVNLWUZNRcBaQKxI" ],
    "timeColumnName" : "Time",
    "units" : [ {
      "unit" : "unit:hectopascal"
    } ]
  } ],
  "fileExtension" : "csv",
  "delimiter" : "semicolon"
}